Food item name,Food group,Data source ,Data source 2,Method,Protein,TRP,THR,ILE,LEU,LYS,MET,CYS,PHE,TYR,VAL,ARG,HIS,Additional information,,,TRP,THR,ILE,LEU,LYS,MET,CYS,PHE,TYR,VAL,HIS,,TRP,THR,ILE,LEU,LYS,SAA,AAA,VAL,HIS,Additional information
,,,,,g/kg,Total IAA g/kg,,,,,,,,,,,,,,,Digestible IAA g/kg ,,,,,,,,,,,,Digestible IAA mg/g protein,,,,,,,,,
Barley (not hulless varieties),Cereal & cereal products,2,,Standardized Ileal,113,1.4,3.9,4.1,7.7,4.3,1.9,2.6,5.5,3.2,5.7,5.5,2.6,,,,1.1,2.9,3.3,6.4,3.2,1.6,2.2,4.6,2.7,4.6,2.1,,9.8,25.9,29.4,56.6,28.5,33.3,64,40.4,18.6,
"Barley, dehulled (11,8% protein)",Cereal & cereal products,7,,Standardized Ileal,118,1,3.4,3.9,7.3,3.9,1.7,2.3,5.5,2.7,5.3,5.1,2.5,Pocured from Siemer Enterprises Inc,,,0.8,2.4,3.0,5.8,2.9,1.3,1.8,4.5,2.1,4.1,2.0,,7.1,20.7,25.1,48.9,24.5,26.8,56,34.6,17.2,
Biscuits (CP>12%),Cereal & cereal products,"1,19",,Standardized Ileal,81,0.8,2.7,2.9,5.4,2,1.2,1.7,3.7,2.3,3.7,3.3,1.9,,,,0.7,2.5,2.7,4.9,1.8,1.1,1.5,3.3,2.2,3.3,1.8,,8.5,30.3,32.9,60.7,22.0,31.6,67,41.1,21.8,
Bread,Cereal & cereal products,"1,19",,Standardized Ileal,121,1.2,4,4.4,8,3,1.8,2.6,5.6,3.4,5.5,5,2.9,,,,1.1,3.6,4.0,7.4,2.8,1.7,2.3,4.9,3.2,5.0,2.7,,8.9,30.1,33.5,61.5,22.8,32.5,67,41.4,22.0,
Maize flour/Corn flour,Cereal & cereal products,1,,Standardized Ileal,76,0.5,2.7,2.6,9.2,2.2,1.6,1.7,3.7,2.8,3.7,3.6,2.3,,,,0.4,2.1,2.2,8.5,1.7,1.5,1.3,3.1,2.5,3.1,1.9,,5.1,27.0,29.4,111.4,22.0,37.0,74,41.4,25.4,
Maize/corn,Cereal & cereal products,2,,Standardized Ileal,88,0.6,3.3,3.3,10.8,2.7,1.9,2.2,4.3,3.7,4.4,4.2,2.6,,,,0.5,2.7,2.9,10.0,2.2,1.7,2.0,3.9,3.3,3.8,2.3,,5.5,31.1,33.0,114.1,24.5,41.9,82,43.5,26.3,
Maize (extruded)/extruded corn,Cereal & cereal products,2,,Standardized Ileal,88,0.6,3.3,3.3,10.8,2.7,1.9,2.2,4.3,3.7,4.4,4.2,2.6,,,,0.5,2.7,2.9,9.8,2.1,1.7,1.9,3.9,3.3,3.8,2.3,,5.7,30.4,32.6,111.7,24.2,41.0,81,43.0,25.7,
Maize (flaked)/flaked corn/rolled corn,Cereal & cereal products,2,,Standardized Ileal,88,0.6,3.3,3.3,10.8,2.7,1.9,2.2,4.3,3.7,4.4,4.2,2.6,,,,0.5,2.7,2.9,9.8,2.1,1.7,1.9,3.9,3.3,3.8,2.3,,5.7,30.4,32.6,111.7,24.2,41.0,81,43.0,25.7,
"Maize (high moisure)/humid corn - 60-70% dry matter, raw",Cereal & cereal products,2,,Standardized Ileal,92,0.6,3.4,3.4,11.4,2.8,1.9,2.3,4.5,3.9,4.6,4.4,2.7,,,,0.5,2.8,3.0,10.6,2.2,1.7,2.0,4.1,3.5,4.0,2.4,,5.2,30.7,32.5,115.2,24.3,40.8,83,43.5,26.1,
Maize bran,Cereal & cereal products,1,,Standardized Ileal,94,0.7,3.5,3.3,10.5,3,2,2.1,4.4,3.4,4.8,4.7,2.7,,,,0.5,2.3,2.5,8.5,2.0,1.7,1.4,3.5,2.7,3.7,2.2,,5.1,24.6,27.0,90.5,21.7,33.1,66,39.3,23.0,
"Maize, yellow dent (7,5% protein)",Cereal & cereal products,7,,Standardized Ileal,75,0.5,2.3,2.3,7.1,2.3,1.4,1.4,2.9,1.9,3.2,3.2,1.9,Procured from Exseed Genetics LLC,,,0.4,1.6,1.7,6.0,1.7,1.3,1.1,2.4,1.5,2.4,1.6,,4.7,21.5,23.3,79.5,23.0,31.2,52,32.0,21.0,
"Maize, nutridense (8,8% protein)",Cereal & cereal products,7,,Standardized Ileal,88,0.5,2.7,3,9.6,2.9,1.7,1.7,3.9,2.4,4,4.1,2.6,Procured from Exseed Genetics LLC,,,0.4,2.1,2.4,8.6,2.3,1.5,1.4,3.4,2.0,3.3,2.3,,4.1,23.3,27.6,98.2,26.0,33.4,62,37.3,25.7,
"Maize, high lysine",Cereal & cereal products,16,,Standardized Ileal,,,,,,,,,,,,,,,,,,,,,,,,,,,,,,,,,,,,,,AA composition data not reported 
"Millet, finger",Cereal & cereal products,4,,True Ileal,,,,,,,,,,,,,,,,,,,,,,,,,,,,,,,,,,,,,,AA composition data not reported 
"Millet, pearl (Penisetum glaucum (l) R. Br)/candle millet/dark millet/bajra/Indian millet/horse millet/bulrush millet/cattail millet",Cereal & cereal products,2,,Standardized Ileal,125,2.2,4.9,5.5,16.4,3.1,4.3,3,6.1,3.9,6.8,4.9,2.9,,,,2.0,4.3,5.0,14.9,2.7,3.6,2.7,5.7,3.4,6.1,2.7,,16.2,34.1,40.0,119.4,21.3,50.5,73,49.0,21.3,
"Millet, proso (Panicum miliaceum L.)/common millet/broomtail millet/hog millet/white millet/broomcorn millet",Cereal & cereal products,2,,Standardized Ileal,142,2.6,5.4,6.4,19,3.2,5,3.3,7,4.4,7.7,5.3,3.1,,,,2.0,4.1,5.2,15.8,2.5,4.2,2.5,5.9,3.6,6.1,2.5,,14.1,28.9,36.5,111.1,17.4,47.0,67,42.8,17.9,
Oat groats (Avena sativa L.)/oat grain from whuch hulls have been removed,Cereal & cereal products,2,,Standardized Ileal,128,1.6,4.5,4.9,9.4,5.3,2.2,4,6.5,4.6,6.8,8.8,2.8,,,,1.3,3.6,4.1,7.8,4.2,1.9,3.4,5.4,3.9,5.5,2.3,,10.3,28.1,31.8,61.0,32.7,41.2,73,43.0,18.2,
Oats (Avena sativa L.),Cereal & cereal products,"1,19",,Standardized Ileal,102,1.2,3.6,3.8,7.5,4.2,1.7,3.1,4.9,3.4,5.3,6.6,2.2,,,,0.9,2.5,3.0,6.2,3.2,1.4,2.2,4.1,2.8,4.2,1.9,,9.1,24.7,29.8,60.3,31.3,35.5,67,41.0,18.3,
Oats (Avena sativa L.),Cereal & cereal products,2,,Standardized Ileal,108,1.4,3.8,4.1,7.9,4.5,1.9,3.6,5.4,3.8,5.7,7.2,2.3,,,,1.1,2.6,3.2,6.4,3.3,1.6,2.7,4.5,3.0,4.4,1.9,,10.1,24.3,30.0,59.3,30.4,39.8,70,40.6,17.7,
"Oats, flaked/flaked or rolled oat grain",Cereal & cereal products,2,,Standardized Ileal,108,1.4,3.8,4.1,7.9,4.5,1.9,3.6,5.4,3.8,5.7,7.2,2.3,,,,1.1,2.6,3.2,6.4,3.3,1.6,2.7,5.0,3.0,4.4,1.9,,10.1,24.3,30.0,59.3,30.4,39.8,74,40.6,17.7,
"Oats, dehulled (13,1% protein)",Cereal & cereal products,7,,Standardized Ileal,131,1,4.3,5.1,9.8,5.7,2.3,4,6.6,3.8,7.1,8.7,3.2,Pocured from Siemer Enterprises Inc,,,0.8,3.5,4.4,8.5,4.9,2.1,3.1,5.8,3.1,6.0,2.8,,6.3,26.6,33.9,65.1,37.4,39.3,68,46.1,21.5,
Rice,Cereal & cereal products,"1,19",,True Ileal,78,0.9,2.9,2.9,5.7,3.3,1.6,1.7,3.7,2.7,4.3,6.1,2.1,,,,0.8,2.4,2.2,4.6,3.0,1.4,1.6,3.2,2.1,3.8,2.1,,10.3,30.5,27.9,59.2,38.9,38.8,68,48.5,26.7,
"Rice, brown (Oryza sativa L.)/unpolished rice without the hulls but with the outer grain layers",Cereal & cereal products,2,,Standardized Ileal,105,1.8,3.8,4.7,8.4,3.9,2.4,1.7,5.5,4.4,6.1,8.4,2.4,,,,1.5,3.2,4.0,7.4,3.4,2.1,1.4,4.9,3.9,5.2,2.1,,14.6,30.4,38.5,70.4,31.9,34.1,83,50.0,20.1,
"Rice, paddy/whole rice grain with the hulls included",Cereal & cereal products,2,,Standardized Ileal,85,1.5,3.1,3.8,6.7,3.2,2.1,1.6,4.3,3.6,5,6.7,1.9,,,,1.1,2.3,3.0,5.5,2.4,1.7,1.2,3.6,2.9,3.9,1.5,,13.4,27.4,35.8,64.6,28.2,34.2,76,45.9,17.9,
"Rice, polished, broken (byproduct of the polishing process consisting of small or broken grains)",Cereal & cereal products,2,,Standardized Ileal,92,1.6,3.3,4.1,7.3,3.5,2.2,1.6,4.7,3.9,5.4,7.3,2.1,,,,1.5,3.1,3.9,6.9,3.3,2.1,1.5,4.4,3.2,5.1,2.0,,16.5,33.7,41.9,75.4,35.8,38.8,83,55.8,21.5,
"Rice, white, polished (9,0% protein)",Cereal & cereal products,7,,Standardized Ileal,90,0.7,2.7,3.5,6.6,3,2.1,1.9,4.2,2.3,4.9,6.1,2.1,Procured from Walmart,,,0.7,2.5,3.2,6.2,2.8,2.0,1.8,4.0,2.1,4.6,1.9,,7.4,27.3,35.8,68.9,30.7,42.0,68,51.2,21.2,
Rice bran,Cereal & cereal products,"1,19",,Standardized Ileal,143,1.6,5.3,5.3,10.4,6,3,3.1,6.7,4.9,7.9,11.1,3.9,,,,1.2,3.4,3.6,7.0,4.1,2.2,2.0,4.6,3.9,5.2,3.0,,8.1,23.7,24.8,48.7,29.0,29.4,59,36.5,21.0,
Rye (Secale cereale L.) ,Cereal & cereal products,2,,Standardized Ileal,98,0.9,3.4,3.4,6,3.9,1.6,2.3,4.3,2.5,4.8,5,2.1,,,,0.7,2.4,2.6,4.7,2.8,1.3,1.9,3.5,1.9,3.6,1.7,,7.0,24.6,26.7,47.8,28.7,32.9,56,36.7,16.9,
"Rye (12,1% protein)",Cereal & cereal products,7,,Standardized Ileal,121,0.9,3.3,3.8,6.7,4.1,1.7,2.2,4.9,2.2,5.1,5.3,2.6,Pocured from Siemer Enterprises Inc,,,0.7,2.1,2.7,5.0,2.7,1.4,1.7,3.9,1.5,3.6,2.0,,5.6,17.5,22.6,41.0,22.7,25.1,44,29.9,16.5,
"Seitan (wheat based protein), 20,9 g/100 g protein)",Cereal & cereal products,8,,Standardized Ileal,209.3,5.7,4.6,7.6,14.2,2.9,3.9,4,10.3,4.9,7.8,2.6,4.7,Commercial origin,,,5.3,4.3,7.3,13.7,2.8,3.8,4.0,10.3,4.6,7.6,4.5,,25.1,20.7,34.9,65.4,13.6,37.1,71,36.1,21.5,
"Sorghum (Sorghum bicolor (L) Moench, low tannin variety",Cereal & cereal products,2,,Standardized Ileal,106,1.1,3.5,4.5,14.4,2.5,1.8,2,5.7,4.3,5.8,4.3,2.4,,,,0.9,2.7,3.7,12.4,1.9,1.5,1.5,4.8,3.7,4.7,1.9,,8.2,25.1,35.2,116.8,17.5,29.0,80,44.3,17.7,
"Sorghum (Sorghum bicolor (L) Moench, low tannin variety",Cereal & cereal products,"1,19",,Standardized Ileal,87,1,2.9,3.5,11.3,2.1,1.6,1.6,4.6,3.4,4.3,3.5,2.1,,,,0.9,2.4,3.0,9.9,1.7,1.4,1.2,4.1,2.9,3.7,1.7,,10.0,28.0,35.0,114.3,19.1,30.3,80,42.5,19.6,
"Sorghum (9,8% protein)",Cereal & cereal products,7,,Standardized Ileal,98,0.5,2.9,3.7,12.4,2,1.5,1.5,4.7,3,4.6,3.3,2.2,Pocured from Siemer Enterprises Inc,,,0.4,2.0,2.7,9.4,1.4,1.2,1.0,3.6,2.1,3.4,1.6,,3.7,20.1,27.9,96.2,14.1,22.2,58,34.3,16.6,
Triticale (Triticum x Secale),Cereal & cereal products,2,,Standardized Ileal,115,1.4,3.8,4.4,7.3,4.5,2,3,5,3.5,5.5,6.1,2.7,,,,1.2,3.1,3.8,6.4,3.7,1.8,2.7,4.5,3.2,4.7,2.4,,10.7,27.1,33.3,55.9,32.5,39.4,67,41.1,20.9,
"Wheat, durum",Cereal & cereal products,2,,Standardized Ileal,164,1.8,4.8,5.9,11.1,4.3,2.6,3.6,8,5.2,7.1,7.9,3.7,,,,1.6,4.0,5.3,10.0,3.5,2.3,3.3,7.3,4.7,6.1,3.3,,9.7,24.3,32.0,60.9,21.2,34.1,73,37.2,20.3,
"Wheat, soft",Cereal & cereal products,2,,Standardized Ileal,126,1.5,3.8,4.5,8.5,3.6,2,3.1,5.9,3.9,5.6,6.3,2.9,,,,1.3,3.2,4.0,7.7,2.9,1.8,2.8,5.4,3.5,4.8,2.6,,10.5,25.0,31.8,60.7,23.1,36.5,70,38.2,20.7,
"Wheat flour (fibre < 3,5%)",Cereal & cereal products,"1,19",,Standardized Ileal,154,2.2,5.1,4.9,9.5,6.1,2.5,3.2,6.1,4.5,7.2,10.3,4.2,,,,2.0,4.4,4.4,8.6,5.3,2.3,2.8,5.4,4.1,6.5,3.8,,12.7,28.5,28.6,56.1,34.5,32.5,62,42.1,24.8,
"Wheat (11,9% protein)",Cereal & cereal products,7,,Standardized Ileal,119,1.3,3.2,3.9,7.3,3.4,1.9,2.5,4.9,2.7,4.9,5.4,2.5,Pocured from Siemer Enterprises Inc,,,1.1,2.1,3.1,5.9,2.5,1.6,2.1,4.1,2.0,3.7,2.1,,9.2,17.5,25.9,49.7,20.9,31.0,51,30.9,17.6,
"Zein protein isolate (89% proteins, Sigma-Aldrich)",Cereal & cereal products,10,,True ileal,890,1.246,29.993,46.903,214.49,0.356,17.444,11.392,71.378,54.824,40.228,17.622,12.549,Naso-ileal intubation method used to continously collect postprandal ileal digesta from healthy volunteers,,,0.8,18.8,29.1,132.3,0.2,10.3,7.1,43.3,33.1,25.8,8.4,,0.9,21.1,32.7,148.7,0.3,19.6,86,29.0,9.4,
,,,,,,,,,,,,,,,,,,,,,,,,,,,,,,,,,,,,,,,,,,
"Beet pulp, dried",Roots & tubers,2,,Standardized Ileal,89,1.1,4,3.9,6.3,5.1,1.5,1,4,4.1,6.1,3.7,3.4,"Dried byproduct of sugar manufacture, obtained after extracting the juice from sugar beet roots (Beta vulgaris L.). Other name: sugar beet pulp.",,,0.5,1.2,2.3,3.7,2.6,0.9,0.2,2.1,2.2,2.6,2.1,,5.1,13.9,25.9,41.8,28.7,12.8,48,28.8,23.3,
"Beet pulp, pressed",Roots & tubers,2,,Standardized Ileal,87,0.9,3.9,3.8,6.1,5,1.4,1,3.9,4.7,6,3.6,3.3,"Humid byproduct of sugar manufacture, obtained after extracting the juice from sugar beet roots (Beta vulgaris L.). The resulting solids are pressed to reduce water content down to 70-80%.",,,0.4,1.2,2.2,3.6,2.5,0.9,0.2,2.0,2.5,2.5,2.0,,4.2,13.9,25.8,41.4,28.7,12.3,52,29.0,23.1,
"Cassava pulp, dried",Roots & tubers,2,,Standardized Ileal,23,0.2,0.7,0.7,1.2,0.9,0.4,0.4,0.8,0.6,1,0.8,0.7,Dried cassava pulp is a dried by-product of the extraction of starch from cassava roots (Manihot esculenta Crantz).  This is a highly variable product.,,,0.1,0.5,0.5,0.9,0.6,0.3,0.3,0.6,0.5,0.7,0.5,,6.1,21.0,23.1,40.7,27.0,25.4,48,32.2,23.1,
Cassava (starch 66-70%),Roots & tubers,2,,Standardized Ileal,29,0.2,0.9,0.9,1.5,1.1,0.5,0.5,1,0.7,1.3,1.1,1.2,,,,0.2,0.6,0.3,1.1,0.7,0.4,0.4,0.6,0.5,1.0,0.9,,5.8,21.4,9.0,38.8,24.3,27.2,37,33.2,31.4,
"Cassava, starch 70-74%",Roots & tubers,2,,Standardized Ileal,28,0.2,0.8,0.8,1.5,1.1,0.5,0.5,1,0.7,1.2,1.1,1.2,"Dried cassava roots (Manihot esculenta Crantz), containing 70-74% starch (as fed). Cassava roots are usually provided as chips, pellets or meal (ground chips).",,,0.2,0.6,0.2,1.1,0.7,0.4,0.4,0.6,0.5,0.9,0.9,,6.1,19.7,8.3,40.2,25.1,28.2,39,31.7,32.6,
"Chicory pulp, dehydrated",Roots & tubers,2,,Standardized Ileal,87,1.4,3.4,3.5,5.9,3.7,1,0.6,3.7,2.6,3.9,3.6,1.5,Byproduct of the extraction of fructose and inuline from chicory roots (Cichorium intybus L.).,,,1.0,2.4,2.7,4.6,2.6,0.8,0.4,3.0,2.0,2.9,1.1,,11.4,27.4,30.6,52.9,29.3,13.8,57,33.2,13.1,
Potato protein concentrate,Roots & tubers,2,,Standardized Ileal,841,11.7,47.2,47,84.3,64.2,18.5,11.4,52.6,44.6,55.1,42.3,17.9,Dried byproduct of starch manufacture from potato tubers (Solanum tuberosum L.) consisting mainly of protein substances obtained after the separation of starch.,,,8.8,42.5,41.8,76.7,57.1,16.8,8.9,47.9,39.7,49.0,15.9,,10.4,50.5,49.7,91.2,67.9,30.6,104,58.3,18.9,
"Potato pulp, dried",Roots & tubers,2,,Standardized Ileal,54,0.2,0.7,0.2,2.3,0.7,0.3,0.7,0.5,1.2,1.4,1,0.5,Dried byproduct of the processing (particularly starch manufacture) of potato tubers (Solanum tuberosum L.).,,,0.2,0.5,0.2,1.9,0.5,0.2,0.5,0.4,1.0,1.1,0.4,,2.8,9.6,2.9,34.5,9.6,13.8,25,20.0,7.4,
"Potato tuber, dried",Roots & tubers,2,,Standardized Ileal,103,0.9,3.6,3.2,5.1,4.6,1.4,1.4,3.7,3.9,4.8,3.5,1.6,Dried whole potato tuber (Solanum tuberosum L.). These are cull potatoes from potato production and potato processing industries.,,,0.8,3.0,2.8,4.5,4.0,1.2,1.2,3.3,3.4,4.1,1.4,,7.4,29.4,26.7,43.6,38.4,23.4,65,39.6,13.7,
Potato crisps,Roots & tubers,1,,Standardized Ileal,59,0.5,2.3,2.2,3.6,3.2,0.8,0.8,2.3,1.9,3.1,1.8,1,,,,0.2,1.1,1.0,1.7,1.5,0.3,0.4,1.1,0.9,1.5,0.4,,4.0,18.3,16.4,28.7,26.0,11.9,33,24.7,7.1,
Potato fries (fat 4-12%) ,Roots & tubers,"1,19",,Standardized Ileal,70,0.6,2.7,2.6,4.3,3.8,1,0.9,2.7,2.3,3.7,2.2,1.2,,,,0.3,1.4,1.3,2.2,1.9,0.5,0.5,1.4,1.1,1.9,0.6,,4.0,20.1,18.9,31.9,27.7,13.4,36,27.5,8.1,
Potato fries (fat 12-18%),Roots & tubers,"1,19",,Standardized Ileal,72,0.6,2.8,2.7,4.4,3.9,1,0.9,2.8,2.4,3.7,2.2,1.2,,,,0.3,1.5,1.4,2.2,2.0,0.5,0.5,1.5,1.3,1.9,0.6,,3.9,20.2,19.1,30.6,28.2,13.0,38,26.7,7.8,
Potato fries (fat >18%),Roots & tubers,1,,Standardized Ileal,64,0.6,2.5,2.4,3.9,3.5,0.9,0.8,2.5,2.1,3.3,2,1.1,,,,0.3,1.2,1.3,2.0,1.8,0.5,0.4,1.3,1.1,1.7,0.6,,4.4,18.8,19.9,30.5,28.4,13.8,37,26.3,8.8,
Potato (dehydrated),Roots & tubers,"1,19",,Standardized Ileal,93,1.4,3.7,4.4,6.4,4.8,1.6,1.4,4,3.6,4.7,4.8,1.6,,,,0.7,2.3,2.5,3.6,3.0,1.1,0.8,2.3,2.1,2.7,0.8,,7.1,24.7,26.5,38.5,32.0,19.5,47,29.3,9.1,
"Potato peelings, steamed, starch <35%)",Roots & tubers,"1,19",,Standardized Ileal,156,1.6,5.9,5.6,9.7,8.6,2.2,1.9,6.2,5.6,7.5,5.3,2.6,,,,0.8,3.7,3.2,5.6,5.4,1.5,0.9,3.5,3.2,4.4,1.5,,5.2,23.4,20.8,36.1,34.7,15.6,43,27.9,9.5,
"Potato peelings, steamed, starch 35-47,5%)",Roots & tubers,"1,19",,Standardized Ileal,135,1.4,5.1,4.9,8.4,7.4,1.9,1.6,5.4,4.9,6.5,4.6,2.3,,,,0.7,3.2,2.8,4.9,4.7,1.3,0.8,3.1,2.7,3.8,1.4,,4.9,23.4,21.1,36.1,35.1,15.8,44,27.9,10.4,
"Potato peelings, steamed, starch 47,5-60%)",Roots & tubers,"1,19",,Standardized Ileal,115,1.1,4.4,4.1,7.1,6.3,1.6,1.4,4.6,4.1,5.5,3.9,1.9,,,,0.5,2.8,2.4,4.0,3.9,1.0,0.7,2.7,2.3,3.1,1.1,,4.5,24.1,21.0,35.2,34.0,14.6,44,27.3,9.6,
"Potato peelings, steamed, starch >60%)",Roots & tubers,"1,19",,Standardized Ileal,102,1,3.9,3.7,6.3,5.6,1.4,1.2,4.1,3.7,4.9,3.5,1.7,,,,0.5,2.4,2.1,3.7,3.5,0.9,0.6,2.3,2.1,2.8,1.0,,5.1,23.3,20.3,36.4,34.6,14.5,44,27.9,9.3,
"Potato (sweet, dehydrated)",Roots & tubers,"1,19",,Standardized Ileal,40,0.4,1.3,1.2,2.2,1.6,0.6,0.6,1.6,1.1,1.6,1.6,0.6,,,,0.2,0.7,0.7,1.1,0.8,0.4,0.3,0.8,0.6,0.8,0.3,,4.7,16.6,16.5,28.1,21.2,16.7,35,18.8,7.1,
"Sweet potato, dried",Roots & tubers,2,,Standardized Ileal,51,0.9,2.4,2.1,2.7,1.9,0.6,0.8,3.1,2,2.7,1.7,1.3,Dried sweet potato tuber (Ipomea batatas (L.) Lam.).,,,0.8,2.0,1.8,2.3,1.6,0.5,0.7,2.7,1.7,2.3,1.1,,14.8,39.1,35.0,46.1,31.7,23.4,88,45.0,22.2,
,,,,,,,,,,,,,,,,,,,,,,,,,,,,,,,,,,,,,,,,,,
"Adzuki bean, cooked (Jihong No.16, Chinese variety),25,5% protein",Legumes & oilseeds,9,,True ileal,255,2.2,6.6,7.7,21.8,13.2,3.1,3.8,7.8,4,9.2,12.8,7.3,,,,1.7,5.7,6.8,20.5,11.9,2.6,2.0,7.0,3.4,8.2,6.5,,6.6,22.4,26.8,80.3,46.5,18.0,41,32.2,25.4,
Alfalfa protein concentrate,Legumes & oilseeds,2,,Standardized Ileal,566,8.7,27.2,28.6,50.1,34.2,11.6,5.4,33.7,24.2,33.9,34,14.3,"Protein concentrate obtained by pressing the aerial part of alfalfa (Medicago sativa L.). In one commercial process, fresh alfalfa is first pressed to obtain a green juice. This juice is then heated and steamed to produce a protein coagulate. This coagulate is separated from the liquid by centrifugation, and then dried. Alfalfa protein concentrate is used for its high content in protein and pigments (caroten, xanthophylls).",,,6.9,21.5,23.5,42.1,27.4,9.9,4.2,28.6,20.3,27.5,12.0,,12.1,38.0,41.4,74.4,48.3,24.9,87,48.5,21.2,
"Alfalfa, dehydrated, protein 16-18% dry matter",Legumes & oilseeds,2,,Standardized Ileal,170,2.4,6.1,6.5,11.5,7.2,1.7,2.2,7.3,4.8,10.3,6.3,2.3,"Dehydrated aerial part of alfalfa (Medicago sativa L.), containing between 16% and 18% protein (in dry matter).",,,1.1,3.8,4.4,8.3,4.0,1.3,0.8,5.3,3.2,6.9,1.3,,6.5,22.6,26.0,48.7,23.3,12.0,50,40.6,7.7,
"Alfalfa, dehydrated, protein > 25% dry matter",Legumes & oilseeds,2,,Standardized Ileal,264,3.9,11.1,11.7,20.7,13.6,4.1,3,13.6,9.4,15.9,12.9,5.1,Dehydrated aerial part of alfalfa (Medicago sativa L.) containing more than 25% protein (in dry matter).,,,1.8,8.0,8.8,15.9,9.8,3.2,1.1,10.2,7.1,11.4,3.5,,6.8,30.3,33.2,60.4,37.1,16.1,66,43.4,13.1,
"Broad beans, cooked (Qingcan No.14, Chinese variety), 29,7% protein",Legumes & oilseeds,9,,True ileal,297,2.1,9.3,10.5,29,16.8,2.1,6.7,8.3,5.8,11.4,27.5,8.1,,,,1.8,8.3,9.7,27.7,15.6,1.7,4.5,7.6,5.1,10.4,6.9,,5.9,27.9,32.5,93.2,52.5,21.2,43,35.0,23.2,
"Chickpea, kabuli type (Cicer arietinum L.)",Legumes & oilseeds,2,,Standardized Ileal,213,2,7.6,8.3,15.6,14.4,2.6,2.6,11.7,4.9,8.6,17.6,5.4,Kabuli (also called garbanzo) chickpeas are tan-coated and are grown primarily in the Mediterranean area and in South America. They contain less crude fibre than the smaller and dark-coated desi types grown in the Indian subcontinent.,,,1.7,5.9,6.8,13.4,13.5,2.3,2.3,10.4,4.4,7.0,4.7,,7.8,27.5,32.0,63.0,63.5,21.7,69,32.7,22.1,
"Chickpea, pressure cooked (Kabuli), (Cicer arietinum) garbanzo bean, var KAK-2, India (22,9 g/100 g protein)",Legumes & oilseeds,17,,True ileal,229.3,,15.2,10.1,15.5,14.4,2.4,,13.4,,9.9,,,,,,,11.0,8.2,12.3,8.6,1.7,,10.8,,7.5,,,,48.1,35.9,53.7,37.7,7.5,47,32.8,,
"Chickpeas (Xinying No1 Y2-12, Chinese variety), 25,3% protein",Legumes & oilseeds,9,,True ileal,253,2.2,7.3,8.4,22.7,13.1,3.1,6.8,8.9,3.8,8.6,19.9,6.5,,,,1.9,5.8,7.1,20.5,11.5,2.7,5.2,7.6,2.9,7.2,4.7,,7.6,22.9,28.2,81.0,45.4,31.3,41,28.3,18.7,
Coconut (extracted),Legumes & oilseeds,1,,True ileal,,,,,,,,,,,,,,,,,,,,,,,,,,,,,,,,,,,,,,AA composition data not reported 
Common bean (Phaseolus vulgaris L.),Legumes & oilseeds,2,,Standardized Ileal,249,2.8,10.7,10.9,19.9,16.4,3.3,2.5,13.5,9.3,12.8,16.1,6.5,"The common bean is known under many names (kidney bean, French bean, navy bean...), depending on the variety.",,,2.3,8.1,7.8,14.1,13.9,2.9,2.0,10.0,6.2,8.3,4.3,,9.2,32.7,31.5,56.7,56.0,19.7,65,33.4,17.2,
Common vetch (Vicia sativa L.),Legumes & oilseeds,2,,Standardized Ileal,283,2.5,9.2,10.2,17.7,15.8,3.1,3.6,11.5,6.8,14.9,19.3,6.9,,,,2.0,7.1,8.3,14.7,12.3,2.6,2.7,9.7,5.6,11.9,5.7,,6.9,25.0,29.2,51.9,43.5,18.9,54,42.1,20.2,
"Cotton seed, whole/full-fat cotton seed (Gossypium spp.)",Legumes & oilseeds,2,,Standardized Ileal,220,2.9,8.3,7.4,13.2,10.4,3.9,3.1,11.7,7,8.9,24.2,8.2,,,,1.9,5.4,5.4,9.9,6.7,3.0,1.9,9.0,5.2,6.2,5.9,,8.7,24.5,24.6,45.0,30.3,22.2,64,28.3,26.8,
"Cotton seed, whole, extruded/full-fat cotton seed (Gossypium spp)",Legumes & oilseeds,2,,Standardized Ileal,220,2.9,8.3,7.4,13.2,10.4,3.9,3.1,11.7,7,8.9,24.2,8.2,,,,1.9,5.4,5.4,9.9,6.7,3.0,1.9,9.0,5.2,6.2,5.9,,8.7,24.5,24.6,45.0,30.3,22.2,64,28.3,26.8,
Cowpea seed (Vigna unguicuilata (L) Walp),Legumes & oilseeds,2,,Standardized Ileal,250,2.8,9.5,10,18.6,16.3,3.7,2.8,13.7,7.5,11.7,16.8,8.2,"Cowpea is a grain legume popular as human food in Africa and in some regions of Asia and the Americas. Other names: black-eyed pea, black-eyed bean, asparagus bean.",,,2.3,7.7,8.4,16.0,13.4,3.2,2.2,11.8,6.4,9.7,7.0,,9.2,30.8,33.6,64.0,53.5,21.7,73,38.8,27.9,
"Faba bean, coloured flowers, high tannin",Legumes & oilseeds,2,,Standardized Ileal,295,2.4,10.5,12,22.4,19.2,2.1,3.7,12.4,9.4,13.3,27.9,7.5,,,,1.7,8.4,9.8,18.8,16.3,1.7,2.7,10.3,7.6,10.5,6.4,,5.7,28.5,33.4,63.8,55.3,14.9,61,35.6,21.6,
"Faba bean, colored flowers, high tannin, extruded, horse bean/field bean (Vicia faba L.)",Legumes & oilseeds,2,,Standardized Ileal,295,2.4,10.5,12,22.4,19.2,2.1,3.7,12.4,9.4,13.3,27.9,7.5,,,,1.7,8.5,9.8,19.0,16.7,1.8,2.8,10.4,7.6,10.8,6.4,,5.8,28.8,33.4,64.5,56.6,15.4,61,36.5,21.6,
"Faba bean, white flowers, low tannin, horse bean/field bean (Vicia faba L.)",Legumes & oilseeds,2,,Standardized Ileal,311,2.6,11.1,12.6,23.6,20,2.2,4,13,9.9,14.1,30.4,7.9,,,,2.0,9.3,10.6,20.5,17.8,1.9,3.1,11.3,8.4,11.7,7.0,,6.3,30.0,34.0,66.0,57.2,16.0,63,37.6,22.6,
"Groundnut flour/peanut flour, dehulled (46,6 g/00 g protein)",Legumes & oilseeds,12,,Standardized Ileal,466,4.7,11.7,16.8,30.6,11.7,5,5.1,24.1,17.9,20,50.4,10.8,,,,3.9,9.6,15.1,28.4,7.8,4.5,4.0,22.7,16.3,18.0,9.3,,8.4,20.7,32.3,60.9,16.7,18.2,84,38.6,19.9,
"Kidney bean, cooked (Ziyun No.2, Chinese variety), 26,2% protein",Legumes & oilseeds,9,,True ileal,262,2.5,10.1,10.8,19.7,16.8,2.7,5,13.8,6.2,12.5,14.6,9,,,,1.9,7.5,8.6,17.5,14.0,2.3,2.2,10.7,3.7,10.0,5.1,,7.4,28.8,32.9,66.7,53.6,17.0,55,38.1,19.4,
Lentils (Lens esculenta Moench),Legumes & oilseeds,2,,Standardized Ileal,264,1.8,9.2,10.4,17.9,16.2,2.1,3.2,11.5,7.1,11,18.8,6.2,,,,1.5,7.5,8.7,15.4,13.3,1.8,2.6,9.9,6.0,9.1,5.3,,5.6,28.2,33.1,58.3,50.3,16.5,60,34.6,20.2,
"Lentils, raw, red (Lens culinaris), 24,7 g/100 g protein",Legumes & oilseeds,13,,Standardized Ileal,247,1.4,8.7,10.9,17.6,17,1.9,2.6,12.2,7.2,12,17.8,5.9,"Sourced from CorLine Commodities, Canada",,,1.2,6.9,8.5,13.9,13.7,1.4,1.9,9.6,5.8,9.3,4.7,,4.9,27.8,34.3,56.3,55.5,13.4,62,37.6,19.0,
"Lentils, steam pelleted at 80-85 oC, (Lens culinaris), 24,3 g/100 g protein",Legumes & oilseeds,13,,Standardized Ileal,243,1.4,8.6,10.7,17.6,16.3,2,2.7,12.2,7.2,11.9,17.4,5.9,"Raw material sourced from CorLine Commodities, Canada",,,1.3,7.4,9.2,15.3,14.2,1.7,2.1,10.5,6.0,10.1,5.1,,5.4,30.3,37.8,62.9,58.6,15.9,68,41.6,20.9,
"Lentils, extruded at 115oC (Lens culinaris), 24,4 g/00 g protein",Legumes & oilseeds,13,,Standardized Ileal,244,1.5,8.6,10.7,17.4,16.6,1.8,2.6,12.1,7.1,11.9,17.6,5.9,"Raw material sourced from CorLine Commodities, Canada",,,1.4,7.6,9.4,15.3,14.6,1.6,2.0,10.8,6.3,10.4,5.1,,5.9,31.0,38.4,62.9,59.8,14.5,70,42.4,21.0,
"Linseed, whole (Linum usitatissimum)/full-fat linseed/full fat flaxseed",Legumes & oilseeds,2,,Standardized Ileal,225,4,10,10.7,14.3,8.8,4.4,4.4,12,6.3,11.8,22.6,5.2,,,,3.0,7.5,8.6,11.7,6.6,3.7,3.2,10.0,5.1,9.2,4.2,,13.5,33.3,38.0,52.1,29.3,30.5,67,40.9,18.7,
"Linseed, whole, extruded (Linum usitatissimum)/full-fat linseed/full fat flaxseed",Legumes & oilseeds,2,,Standardized Ileal,225,4,10,10.7,14.3,8.8,4.4,4.4,12,6.3,11.8,22.6,5.2,,,,3.0,7.5,8.6,11.7,6.6,3.7,3.2,10.0,5.1,9.2,4.2,,13.5,33.3,38.0,52.1,29.3,30.5,67,40.9,18.7,
"Lupin, blue (Lupinus angustifolius L.)/narrowleaf lupin",Legumes & oilseeds,2,,Standardized Ileal,333,2.5,13.1,15.5,24.7,16.8,2.9,6,13.2,15.3,14.9,32.9,7.5,,,,1.9,10.9,13.6,21.7,14.6,2.5,5.2,11.9,13.5,12.5,6.9,,5.8,32.7,41.0,65.3,43.9,23.0,76,37.6,20.7,
"Lupin, white (Lupinus albus L.)",Legumes & oilseeds,2,,Standardized Ileal,380,2.6,14.1,17.6,27.6,18.5,3,6.3,14.8,17.7,16.4,40.9,8.3,,,,2.0,11.0,15.3,23.7,15.2,2.3,4.8,12.7,15.8,12.1,7.1,,5.3,28.9,40.3,62.5,39.9,18.6,75,31.9,18.8,
"Lupin, white, extruded (Lupinus albus L.)",Legumes & oilseeds,2,,Standardized Ileal,380,2.6,14.1,17.6,27.6,18.5,3,6.3,14.8,17.7,16.4,40.9,8.3,,,,2.0,11.0,15.3,23.7,15.2,2.3,4.8,12.7,15.8,12.1,7.1,,5.3,28.9,40.3,62.5,39.9,18.6,75,31.9,18.8,
"Mung bean (Vigna radiata, var. KKM-3), India (24,9 g/100 g protein)",Legumes & oilseeds,17,,True ileal,249.4,,12.8,10.5,17.5,16.1,2.1,,15.4,,12.2,,,,,,0.0,5.4,8.0,11.8,10.1,1.1,0.0,11.3,0.0,8.3,0.0,,0.0,21.8,31.9,47.4,40.7,4.4,45,33.2,0.0,
"Mung bean, dehulled (Vigna radiata, var. KKM-3), India (25,7 g/100 g protein)",Legumes & oilseeds,17,,True ileal,251.7,,13,10.3,18,16.1,2.3,,15.6,,12.4,,,,,,0.0,7.1,8.5,13.7,10.2,1.5,0.0,11.7,0.0,9.9,0.0,,0.0,28.1,33.9,54.6,40.6,5.9,47,39.4,0.0,
"Mung bean, cooked (Yulc No.1, Chinese variety), 26,1% protein",Legumes & oilseeds,9,,True ileal,261,2.4,8,10.1,18.8,16.5,3.3,6.2,14.4,5.2,11.8,16.3,8.2,,,,2.0,6.2,8.4,17.0,14.2,2.7,3.3,12.1,4.0,9.8,5.6,,7.6,23.6,32.1,65.3,54.4,23.1,62,37.4,21.4,
Pea (Pisum sativum L.),Legumes & oilseeds,2,,Standardized Ileal,233,2,8.9,9.8,16.6,17,2.3,3.2,11,7.3,11,19.9,5.9,,,,1.5,6.8,7.7,13.3,14.1,1.8,2.3,8.8,5.9,8.5,5.0,,6.3,29.0,33.2,57.0,60.6,17.8,63,36.4,21.3,
Pea (Pisum sativum L.),Legumes & oilseeds,"1,19",,Standardized Ileal,203,1.8,7.5,8.3,14.4,14.4,2,3,9.5,6.7,9.3,17.8,5.1,,,,1.2,5.6,6.4,11.1,11.7,1.5,2.2,7.2,5.2,6.9,4.1,,6.1,27.3,31.5,54.6,57.5,18.1,61,33.9,20.3,
"Pea, extruded (Pisum sativum L.)",Legumes & oilseeds,2,,Standardized Ileal,233,2,8.9,9.8,16.6,17,2.3,3.2,11,7.3,11,19.9,5.9,,,,1.8,8.0,8.9,15.3,15.8,2.0,2.8,10.2,6.9,9.8,5.5,,7.6,34.4,38.3,65.5,67.9,20.6,73,42.0,23.8,
Pea protein concentrate,Legumes & oilseeds,2,,Standardized Ileal,837,6.6,26.4,30.6,56.4,51.6,6.5,7.7,36.1,22.9,33.8,97.9,21.1,"Protein fraction of the pea seed (Pisum sativum L.), extracted by a wet process.",,,5.9,17.2,28.5,53.0,49.0,5.9,6.9,34.3,21.5,31.4,20.3,,7.1,20.5,34.0,63.3,58.6,15.2,67,37.6,24.2,
"Pea emulsion (soybean oil-in-water emulsion containing a pea isolate), 16.79 g/100 g protein)",Legumes & oilseeds,8,,Standardized Ileal,167.9,5.1,6.5,8,14.4,11.8,0.8,1.5,9.4,5.3,8.1,4.5,5.3,"Emulison was created using a commercial pea isolate (Pisane M9, Cosucra, Belgium) and commercial soybean oil",,,5.1,6.0,7.6,13.6,11.1,0.6,1.5,9.2,5.2,7.7,4.9,,30.3,35.8,45.1,81.0,66.0,12.8,86,45.7,29.0,
"Peas, cooked (Dingwan No.4, Chinese variety), 24,3% protein",Legumes & oilseeds,9,,True ileal,243,2,8.1,9,17,15.8,2.1,6.3,7.8,4.4,9.8,22.7,7.2,,,,1.7,6.7,8.0,15.8,14.4,1.9,4.7,6.8,3.6,8.5,5.4,,7.2,27.7,32.7,65.1,59.2,27.1,43,35.1,22.3,
"Pea, yellow, pressure cooked (Pisum sativum; var. Salamanca) (24,4 g/100 g protein)",Legumes & oilseeds,17,,True ileal,244.3,,15.6,10,16.2,15.7,2,,12.3,,10.9,,,,,,0.0,10.4,8.0,11.3,9.7,1.1,0.0,9.9,0.0,8.4,0.0,,0.0,42.7,32.5,46.4,39.9,4.6,41,34.5,0.0,
